{
  "id": "the-urgent-tax-advance-estimator",
  "name": "The Urgent Tax Advance Estimator",
  "brand": "DAC & Bank Breezy",
  "industry": "funding-finance",
  "audience": "Tax Preparers / Gig Workers",
  "problem": "Clients owe IRS, risk penalties, and lack the liquid cash to pay. 3, 4",
  "tier": 1,
  "assetType": "calculator",
  "inputs": [],
  "outputs": [
    "IRS Protection Advance Estimate (Summary) 3"
  ],
  "coreLogic": "Advance = Avg Rev * 0.5 to 1.5; Penalty Savings = Est. Tax * 0.005 * Months Past Due. 3",
  "primaryAction": "Get My Estimate",
  "delivery": "static-site",
  "template": "static-calculator",
  "source": "funding-tools-financial-calculators"
}