{
  "id": "the-premium-finance-gap-calculator",
  "name": "The Premium Finance Gap Calculator",
  "brand": "DAC & Bank Breezy",
  "industry": "funding-finance",
  "audience": "Commercial Insurance Agents",
  "problem": "Losing policy renewals because clients cannot afford the 20-30% premium down payment. 1, 2",
  "tier": 1,
  "assetType": "calculator",
  "inputs": [],
  "outputs": [
    "Policy-Bound Checklist & Funding Quote (PDF) 1"
  ],
  "coreLogic": "Calculates (Total Premium * Down Payment %) - Available Cash to find the exact financing gap. 1",
  "primaryAction": "Get My Estimate",
  "delivery": "static-site",
  "template": "static-calculator",
  "source": "funding-tools-financial-calculators"
}